{
  "tool": "launchgrade",
  "version": "0.1.0",
  "generatedAt": "2026-10-23T14:17:47.774Z",
  "url": "https://fastpresspages.github.io/YouLauncher/",
  "requestedUrl": "https://fastpresspages.github.io/YouLauncher/",
  "httpStatus": 200,
  "responseMs": 379,
  "htmlBytes": 16858,
  "grade": "A+",
  "score": 100,
  "label": "Launch-ready",
  "counts": {
    "pass": 47,
    "warn": 1,
    "fail": 0,
    "info": 5,
    "error": 0,
    "skipped": 0,
    "total": 53
  },
  "categories": [
    {
      "key": "conversion",
      "label": "Conversion",
      "short": "Convert",
      "score": 100,
      "weight": 25,
      "counts": {
        "pass": 7,
        "warn": 0,
        "fail": 0
      }
    },
    {
      "key": "trust",
      "label": "Trust",
      "short": "Trust",
      "score": 100,
      "weight": 15,
      "counts": {
        "pass": 5,
        "warn": 0,
        "fail": 0
      }
    },
    {
      "key": "technical",
      "label": "Technical",
      "short": "Tech",
      "score": 98,
      "weight": 20,
      "counts": {
        "pass": 11,
        "warn": 1,
        "fail": 0
      }
    },
    {
      "key": "seo",
      "label": "SEO",
      "short": "SEO",
      "score": 100,
      "weight": 15,
      "counts": {
        "pass": 9,
        "warn": 0,
        "fail": 0
      }
    },
    {
      "key": "social",
      "label": "Social sharing",
      "short": "Social",
      "score": 100,
      "weight": 10,
      "counts": {
        "pass": 3,
        "warn": 0,
        "fail": 0
      }
    },
    {
      "key": "a11y",
      "label": "Accessibility",
      "short": "A11y",
      "score": 100,
      "weight": 5,
      "counts": {
        "pass": 5,
        "warn": 0,
        "fail": 0
      }
    },
    {
      "key": "agent",
      "label": "AI-agent readiness",
      "short": "Agents",
      "score": 100,
      "weight": 10,
      "counts": {
        "pass": 7,
        "warn": 0,
        "fail": 0
      }
    }
  ],
  "topFixes": [
    {
      "id": "tech.analytics",
      "status": "warn",
      "title": "Measures visits",
      "detail": "No analytics detected.",
      "fix": "Add privacy-friendly analytics (Plausible, Umami, or a simple counter) before you announce.",
      "impact": 0.45
    }
  ],
  "checks": [
    {
      "id": "conv.email-capture",
      "category": "conversion",
      "title": "Has an email capture",
      "status": "pass",
      "weight": 3,
      "detail": "4 forms can capture an email.",
      "fix": ""
    },
    {
      "id": "conv.cta",
      "category": "conversion",
      "title": "Has a specific call to action",
      "status": "pass",
      "weight": 3,
      "detail": "Found a direct CTA: “Grow with us”.",
      "fix": ""
    },
    {
      "id": "conv.social-proof",
      "category": "conversion",
      "title": "Shows social proof",
      "status": "pass",
      "weight": 2,
      "detail": "Social proof language found (“review”).",
      "fix": ""
    },
    {
      "id": "conv.friction",
      "category": "conversion",
      "title": "Keeps signup friction low",
      "status": "pass",
      "weight": 2,
      "detail": "The lightest form asks for 1 field.",
      "fix": ""
    },
    {
      "id": "conv.contact",
      "category": "conversion",
      "title": "Offers a human contact path",
      "status": "pass",
      "weight": 2,
      "detail": "Direct email link found (meetcode99@gmail.com).",
      "fix": ""
    },
    {
      "id": "conv.value-prop",
      "category": "conversion",
      "title": "States a clear value proposition",
      "status": "pass",
      "weight": 2,
      "detail": "H1 is 6 words and a meta description explains the offer.",
      "fix": ""
    },
    {
      "id": "conv.risk-reversal",
      "category": "conversion",
      "title": "Reverses the risk of clicking",
      "status": "pass",
      "weight": 1,
      "detail": "Risk-reversal language found (“no spam”).",
      "fix": ""
    },
    {
      "id": "trust.privacy",
      "category": "trust",
      "title": "Links a privacy policy",
      "status": "pass",
      "weight": 3,
      "detail": "Privacy policy link found.",
      "fix": ""
    },
    {
      "id": "trust.terms",
      "category": "trust",
      "title": "Links terms of service",
      "status": "pass",
      "weight": 2,
      "detail": "Terms link found.",
      "fix": ""
    },
    {
      "id": "trust.about",
      "category": "trust",
      "title": "Explains who is behind the page",
      "status": "pass",
      "weight": 1,
      "detail": "About/team link found (“About”).",
      "fix": ""
    },
    {
      "id": "trust.social-presence",
      "category": "trust",
      "title": "Links a real social profile",
      "status": "pass",
      "weight": 1,
      "detail": "Social profile linked (github.com).",
      "fix": ""
    },
    {
      "id": "trust.security-txt",
      "category": "trust",
      "title": "Publishes a security contact",
      "status": "info",
      "weight": 1,
      "detail": "No /.well-known/security.txt (optional for launch pages).",
      "fix": "Add one when you start handling accounts or payments."
    },
    {
      "id": "trust.copyright",
      "category": "trust",
      "title": "Shows a current footer",
      "status": "pass",
      "weight": 1,
      "detail": "Footer copyright is current (2026).",
      "fix": ""
    },
    {
      "id": "tech.https",
      "category": "technical",
      "title": "Serves over HTTPS",
      "status": "pass",
      "weight": 3,
      "detail": "Final URL is HTTPS.",
      "fix": ""
    },
    {
      "id": "tech.status",
      "category": "technical",
      "title": "Returns a healthy status",
      "status": "pass",
      "weight": 3,
      "detail": "Page returned HTTP 200.",
      "fix": ""
    },
    {
      "id": "tech.speed",
      "category": "technical",
      "title": "Loads the HTML quickly",
      "status": "pass",
      "weight": 2,
      "detail": "HTML arrived in 379 ms.",
      "fix": ""
    },
    {
      "id": "tech.compression",
      "category": "technical",
      "title": "Compresses the response",
      "status": "pass",
      "weight": 2,
      "detail": "Content-Encoding: gzip.",
      "fix": ""
    },
    {
      "id": "tech.cache",
      "category": "technical",
      "title": "Sets cache headers",
      "status": "pass",
      "weight": 1,
      "detail": "Cache-Control: max-age=600.",
      "fix": ""
    },
    {
      "id": "tech.viewport",
      "category": "technical",
      "title": "Is mobile-ready",
      "status": "pass",
      "weight": 2,
      "detail": "Responsive viewport is configured.",
      "fix": ""
    },
    {
      "id": "tech.indexable",
      "category": "technical",
      "title": "Allows search indexing",
      "status": "pass",
      "weight": 2,
      "detail": "No noindex directive found.",
      "fix": ""
    },
    {
      "id": "tech.canonical",
      "category": "technical",
      "title": "Declares a canonical URL",
      "status": "pass",
      "weight": 2,
      "detail": "Canonical: https://fastpresspages.github.io/YouLauncher/.",
      "fix": ""
    },
    {
      "id": "tech.lang",
      "category": "technical",
      "title": "Declares the page language",
      "status": "pass",
      "weight": 1,
      "detail": "html lang=\"en\".",
      "fix": ""
    },
    {
      "id": "tech.favicon",
      "category": "technical",
      "title": "Has a favicon",
      "status": "pass",
      "weight": 1,
      "detail": "Favicon linked (favicon.svg).",
      "fix": ""
    },
    {
      "id": "tech.mixed-content",
      "category": "technical",
      "title": "Avoids mixed content",
      "status": "pass",
      "weight": 2,
      "detail": "No insecure http:// assets found.",
      "fix": ""
    },
    {
      "id": "tech.analytics",
      "category": "technical",
      "title": "Measures visits",
      "status": "warn",
      "weight": 1,
      "detail": "No analytics detected.",
      "fix": "Add privacy-friendly analytics (Plausible, Umami, or a simple counter) before you announce."
    },
    {
      "id": "seo.title",
      "category": "seo",
      "title": "Has a well-sized title",
      "status": "pass",
      "weight": 3,
      "detail": "Title is 43 characters.",
      "fix": ""
    },
    {
      "id": "seo.description",
      "category": "seo",
      "title": "Has a meta description",
      "status": "pass",
      "weight": 3,
      "detail": "Description is 158 characters.",
      "fix": ""
    },
    {
      "id": "seo.h1",
      "category": "seo",
      "title": "Has exactly one H1",
      "status": "pass",
      "weight": 3,
      "detail": "One H1: “Have an idea? We'll grow it.”.",
      "fix": ""
    },
    {
      "id": "seo.heading-order",
      "category": "seo",
      "title": "Uses a sane heading outline",
      "status": "pass",
      "weight": 1,
      "detail": "16 headings, 6 H2 sections.",
      "fix": ""
    },
    {
      "id": "seo.alt",
      "category": "seo",
      "title": "Describes its images",
      "status": "info",
      "weight": 2,
      "detail": "No images to check.",
      "fix": ""
    },
    {
      "id": "seo.sitemap",
      "category": "seo",
      "title": "Publishes a sitemap",
      "status": "pass",
      "weight": 2,
      "detail": "sitemap.xml is valid XML.",
      "fix": ""
    },
    {
      "id": "seo.robots",
      "category": "seo",
      "title": "Publishes robots.txt",
      "status": "pass",
      "weight": 1,
      "detail": "robots.txt is published.",
      "fix": ""
    },
    {
      "id": "seo.schema",
      "category": "seo",
      "title": "Adds structured data",
      "status": "pass",
      "weight": 2,
      "detail": "JSON-LD found: Organization, WebSite, FAQPage.",
      "fix": ""
    },
    {
      "id": "seo.internal-links",
      "category": "seo",
      "title": "Links its own pages",
      "status": "pass",
      "weight": 1,
      "detail": "4 internal links found.",
      "fix": ""
    },